{
  "schema_version": "pkb001.scenario-proposal.v0.1",
  "artifact_kind": "SCENARIO_PROPOSAL",
  "run_id": "pkb001-scenarios-petclinic-818c413-20260905-01",
  "proposal_revision": 1,
  "authority": "PROPOSAL_ONLY",
  "scenario_status": "UNREVIEWED",
  "review_language": "zh-TW",
  "source_revision": "818c4136ea971c21674525f9053de0d9c7ad8cfe",
  "graph_sha256": "e1f6b1933c9529623b0ddd8b2d051349bf79b3f9baebe89c89c391c856bf629e",
  "history_cutoff": "2026-08-26T10:57:54Z",
  "generation_context": {
    "generator_role": "SCENARIO_PROPOSAL_AGENT",
    "generator_identity": "codex:/root/scenario_evidence",
    "evaluator_gold_access": "PROHIBITED",
    "accepted_forward_semantics_access": "PROHIBITED",
    "post_generation_judgments_access": "PROHIBITED"
  },
  "reviewer_exposure": {
    "technical_evidence_visible": true,
    "content_level_arm_anonymity": "NOT_CLAIMED"
  },
  "experiment_limitation": "RECONSTRUCTION_CONSISTENCY_NOT_INDEPENDENT_PRODUCT_VALIDATION",
  "generation_inputs": [
    {
      "kind": "GRAPHIFY_BINDING",
      "path": "validation/pkb001/runtime/graphify-petclinic-live-evidence.json",
      "sha256": "fd3b6729e720e33c89c87cb987748b17ee6cc4ac1fad2c09ddbf093ab39cd5f8"
    },
    {
      "kind": "FROZEN_GRAPH",
      "path": "validation/pkb001/artifacts/petclinic-graph-818c413.json",
      "sha256": "e1f6b1933c9529623b0ddd8b2d051349bf79b3f9baebe89c89c391c856bf629e"
    },
    {
      "kind": "DELIVERY_HISTORY",
      "path": "validation/pkb001/datasets/petclinic-delivery-history.json",
      "sha256": "87b70439f69bb82cee0139b65108ecce6044aff1a4d1b5ce6324933acbeab2d1"
    },
    {
      "kind": "SCENARIO_SKILL",
      "path": "skills/pkb001/pk-scenario-proposal/SKILL.md",
      "sha256": "e4cd82a7f285f37d0a4b28766db4730ab1e4e7a73b42c7e77ad5e7625b081599"
    }
  ],
  "channel_availability": {
    "STRUCTURAL": {
      "status": "AVAILABLE",
      "reason": null
    },
    "DELIVERY_HISTORY": {
      "status": "AVAILABLE",
      "reason": null
    }
  },
  "evidence_catalog": [
    {
      "evidence_id": "EV-G-N031",
      "channel": "STRUCTURAL",
      "artifact_path": "validation/pkb001/artifacts/petclinic-graph-818c413.json",
      "artifact_sha256": "e1f6b1933c9529623b0ddd8b2d051349bf79b3f9baebe89c89c391c856bf629e",
      "json_pointer": "/nodes/31"
    },
    {
      "evidence_id": "EV-G-N040",
      "channel": "STRUCTURAL",
      "artifact_path": "validation/pkb001/artifacts/petclinic-graph-818c413.json",
      "artifact_sha256": "e1f6b1933c9529623b0ddd8b2d051349bf79b3f9baebe89c89c391c856bf629e",
      "json_pointer": "/nodes/40"
    },
    {
      "evidence_id": "EV-G-N041",
      "channel": "STRUCTURAL",
      "artifact_path": "validation/pkb001/artifacts/petclinic-graph-818c413.json",
      "artifact_sha256": "e1f6b1933c9529623b0ddd8b2d051349bf79b3f9baebe89c89c391c856bf629e",
      "json_pointer": "/nodes/41"
    },
    {
      "evidence_id": "EV-G-N043",
      "channel": "STRUCTURAL",
      "artifact_path": "validation/pkb001/artifacts/petclinic-graph-818c413.json",
      "artifact_sha256": "e1f6b1933c9529623b0ddd8b2d051349bf79b3f9baebe89c89c391c856bf629e",
      "json_pointer": "/nodes/43"
    },
    {
      "evidence_id": "EV-G-N045",
      "channel": "STRUCTURAL",
      "artifact_path": "validation/pkb001/artifacts/petclinic-graph-818c413.json",
      "artifact_sha256": "e1f6b1933c9529623b0ddd8b2d051349bf79b3f9baebe89c89c391c856bf629e",
      "json_pointer": "/nodes/45"
    },
    {
      "evidence_id": "EV-G-N046",
      "channel": "STRUCTURAL",
      "artifact_path": "validation/pkb001/artifacts/petclinic-graph-818c413.json",
      "artifact_sha256": "e1f6b1933c9529623b0ddd8b2d051349bf79b3f9baebe89c89c391c856bf629e",
      "json_pointer": "/nodes/46"
    },
    {
      "evidence_id": "EV-G-N047",
      "channel": "STRUCTURAL",
      "artifact_path": "validation/pkb001/artifacts/petclinic-graph-818c413.json",
      "artifact_sha256": "e1f6b1933c9529623b0ddd8b2d051349bf79b3f9baebe89c89c391c856bf629e",
      "json_pointer": "/nodes/47"
    },
    {
      "evidence_id": "EV-G-N048",
      "channel": "STRUCTURAL",
      "artifact_path": "validation/pkb001/artifacts/petclinic-graph-818c413.json",
      "artifact_sha256": "e1f6b1933c9529623b0ddd8b2d051349bf79b3f9baebe89c89c391c856bf629e",
      "json_pointer": "/nodes/48"
    },
    {
      "evidence_id": "EV-G-N051",
      "channel": "STRUCTURAL",
      "artifact_path": "validation/pkb001/artifacts/petclinic-graph-818c413.json",
      "artifact_sha256": "e1f6b1933c9529623b0ddd8b2d051349bf79b3f9baebe89c89c391c856bf629e",
      "json_pointer": "/nodes/51"
    },
    {
      "evidence_id": "EV-G-N064",
      "channel": "STRUCTURAL",
      "artifact_path": "validation/pkb001/artifacts/petclinic-graph-818c413.json",
      "artifact_sha256": "e1f6b1933c9529623b0ddd8b2d051349bf79b3f9baebe89c89c391c856bf629e",
      "json_pointer": "/nodes/64"
    },
    {
      "evidence_id": "EV-G-N069",
      "channel": "STRUCTURAL",
      "artifact_path": "validation/pkb001/artifacts/petclinic-graph-818c413.json",
      "artifact_sha256": "e1f6b1933c9529623b0ddd8b2d051349bf79b3f9baebe89c89c391c856bf629e",
      "json_pointer": "/nodes/69"
    },
    {
      "evidence_id": "EV-G-N070",
      "channel": "STRUCTURAL",
      "artifact_path": "validation/pkb001/artifacts/petclinic-graph-818c413.json",
      "artifact_sha256": "e1f6b1933c9529623b0ddd8b2d051349bf79b3f9baebe89c89c391c856bf629e",
      "json_pointer": "/nodes/70"
    },
    {
      "evidence_id": "EV-G-N072",
      "channel": "STRUCTURAL",
      "artifact_path": "validation/pkb001/artifacts/petclinic-graph-818c413.json",
      "artifact_sha256": "e1f6b1933c9529623b0ddd8b2d051349bf79b3f9baebe89c89c391c856bf629e",
      "json_pointer": "/nodes/72"
    },
    {
      "evidence_id": "EV-G-N074",
      "channel": "STRUCTURAL",
      "artifact_path": "validation/pkb001/artifacts/petclinic-graph-818c413.json",
      "artifact_sha256": "e1f6b1933c9529623b0ddd8b2d051349bf79b3f9baebe89c89c391c856bf629e",
      "json_pointer": "/nodes/74"
    },
    {
      "evidence_id": "EV-G-N092",
      "channel": "STRUCTURAL",
      "artifact_path": "validation/pkb001/artifacts/petclinic-graph-818c413.json",
      "artifact_sha256": "e1f6b1933c9529623b0ddd8b2d051349bf79b3f9baebe89c89c391c856bf629e",
      "json_pointer": "/nodes/92"
    },
    {
      "evidence_id": "EV-G-N094",
      "channel": "STRUCTURAL",
      "artifact_path": "validation/pkb001/artifacts/petclinic-graph-818c413.json",
      "artifact_sha256": "e1f6b1933c9529623b0ddd8b2d051349bf79b3f9baebe89c89c391c856bf629e",
      "json_pointer": "/nodes/94"
    },
    {
      "evidence_id": "EV-G-N100",
      "channel": "STRUCTURAL",
      "artifact_path": "validation/pkb001/artifacts/petclinic-graph-818c413.json",
      "artifact_sha256": "e1f6b1933c9529623b0ddd8b2d051349bf79b3f9baebe89c89c391c856bf629e",
      "json_pointer": "/nodes/100"
    },
    {
      "evidence_id": "EV-G-N101",
      "channel": "STRUCTURAL",
      "artifact_path": "validation/pkb001/artifacts/petclinic-graph-818c413.json",
      "artifact_sha256": "e1f6b1933c9529623b0ddd8b2d051349bf79b3f9baebe89c89c391c856bf629e",
      "json_pointer": "/nodes/101"
    },
    {
      "evidence_id": "EV-G-N103",
      "channel": "STRUCTURAL",
      "artifact_path": "validation/pkb001/artifacts/petclinic-graph-818c413.json",
      "artifact_sha256": "e1f6b1933c9529623b0ddd8b2d051349bf79b3f9baebe89c89c391c856bf629e",
      "json_pointer": "/nodes/103"
    },
    {
      "evidence_id": "EV-G-N113",
      "channel": "STRUCTURAL",
      "artifact_path": "validation/pkb001/artifacts/petclinic-graph-818c413.json",
      "artifact_sha256": "e1f6b1933c9529623b0ddd8b2d051349bf79b3f9baebe89c89c391c856bf629e",
      "json_pointer": "/nodes/113"
    },
    {
      "evidence_id": "EV-G-N114",
      "channel": "STRUCTURAL",
      "artifact_path": "validation/pkb001/artifacts/petclinic-graph-818c413.json",
      "artifact_sha256": "e1f6b1933c9529623b0ddd8b2d051349bf79b3f9baebe89c89c391c856bf629e",
      "json_pointer": "/nodes/114"
    },
    {
      "evidence_id": "EV-G-N115",
      "channel": "STRUCTURAL",
      "artifact_path": "validation/pkb001/artifacts/petclinic-graph-818c413.json",
      "artifact_sha256": "e1f6b1933c9529623b0ddd8b2d051349bf79b3f9baebe89c89c391c856bf629e",
      "json_pointer": "/nodes/115"
    },
    {
      "evidence_id": "EV-G-N124",
      "channel": "STRUCTURAL",
      "artifact_path": "validation/pkb001/artifacts/petclinic-graph-818c413.json",
      "artifact_sha256": "e1f6b1933c9529623b0ddd8b2d051349bf79b3f9baebe89c89c391c856bf629e",
      "json_pointer": "/nodes/124"
    },
    {
      "evidence_id": "EV-G-N130",
      "channel": "STRUCTURAL",
      "artifact_path": "validation/pkb001/artifacts/petclinic-graph-818c413.json",
      "artifact_sha256": "e1f6b1933c9529623b0ddd8b2d051349bf79b3f9baebe89c89c391c856bf629e",
      "json_pointer": "/nodes/130"
    },
    {
      "evidence_id": "EV-G-N131",
      "channel": "STRUCTURAL",
      "artifact_path": "validation/pkb001/artifacts/petclinic-graph-818c413.json",
      "artifact_sha256": "e1f6b1933c9529623b0ddd8b2d051349bf79b3f9baebe89c89c391c856bf629e",
      "json_pointer": "/nodes/131"
    },
    {
      "evidence_id": "EV-G-N132",
      "channel": "STRUCTURAL",
      "artifact_path": "validation/pkb001/artifacts/petclinic-graph-818c413.json",
      "artifact_sha256": "e1f6b1933c9529623b0ddd8b2d051349bf79b3f9baebe89c89c391c856bf629e",
      "json_pointer": "/nodes/132"
    },
    {
      "evidence_id": "EV-G-L056",
      "channel": "STRUCTURAL",
      "artifact_path": "validation/pkb001/artifacts/petclinic-graph-818c413.json",
      "artifact_sha256": "e1f6b1933c9529623b0ddd8b2d051349bf79b3f9baebe89c89c391c856bf629e",
      "json_pointer": "/links/56"
    },
    {
      "evidence_id": "EV-G-L057",
      "channel": "STRUCTURAL",
      "artifact_path": "validation/pkb001/artifacts/petclinic-graph-818c413.json",